{
  "id": "embervault.content-creator",
  "name": "Content Creator Worker",
  "version": "0.1.0",
  "publisher": "EmberVault",
  "minimum_core_version": "0.1.0",
  "capabilities": ["content-creator"],
  "feature_state": "experimental",
  "process_mode": "separate",
  "executable": "content_stub.py"
}
